{
  "schema": "https://ai-atoms.com/schemas/model-v1.json",
  "type": "model",
  "id": "model/cogito-2.1",
  "version": "1.0.0",
  "name": "cogito-2.1",
  "description": "The Cogito v2.1 LLMs are instruction tuned generative models. All models are released under MIT license for commercial use.",
  "vendor": "Deep Cogito",
  "family": "Cogito",
  "task": "text-generation",
  "capabilities": [],
  "parameter_sizes": [
    "671b"
  ],
  "providers": [
    {
      "name": "Ollama",
      "model_id": "cogito-2.1",
      "url": "https://ollama.com/library/cogito-2.1",
      "pull_command": "ollama pull cogito-2.1",
      "run_command": "ollama run cogito-2.1",
      "tag_count": 5,
      "pulls": "222K",
      "updated_at": "2025-11-19"
    }
  ],
  "links": {
    "model_card": "https://ollama.com/library/cogito-2.1"
  },
  "authored_by": "Deep Cogito",
  "source_url": "https://ollama.com/library/cogito-2.1",
  "category": "ai",
  "provenance": {
    "source": "ollama.com/library",
    "source_url": "https://ollama.com/library/cogito-2.1",
    "license": "unknown",
    "imported_at": "2026-09-03",
    "notes": "Description, capabilities, sizes, pulls, tag count and updated date as shown on the Ollama library page. Vendor, family and task are inferred from the model name; weights license is not published on the listing."
  },
  "tags": [
    "ollama",
    "local"
  ],
  "lifecycle": "stable"
}
