{
  "schema": "https://ai-atoms.com/schemas/model-v1.json",
  "type": "model",
  "id": "model/ornith-1.5",
  "version": "1.0.0",
  "name": "ornith-1.5",
  "description": "Chirp Chirp! 🐦 We are introducing Ornith-1.5, a major step toward building foundation models through end-to-end self-improvement.",
  "vendor": "unknown",
  "task": "multimodal",
  "capabilities": [
    "vision"
  ],
  "parameter_sizes": [
    "9b",
    "35b",
    "397b"
  ],
  "providers": [
    {
      "name": "Ollama",
      "model_id": "ornith-1.5",
      "url": "https://ollama.com/library/ornith-1.5",
      "pull_command": "ollama pull ornith-1.5",
      "run_command": "ollama run ornith-1.5",
      "tag_count": 3,
      "pulls": "286.3K",
      "updated_at": "2026-08-19"
    }
  ],
  "links": {
    "model_card": "https://ollama.com/library/ornith-1.5"
  },
  "authored_by": "unknown",
  "source_url": "https://ollama.com/library/ornith-1.5",
  "category": "ai",
  "provenance": {
    "source": "ollama.com/library",
    "source_url": "https://ollama.com/library/ornith-1.5",
    "license": "unknown",
    "imported_at": "2026-09-03",
    "notes": "Description, capabilities, sizes, pulls, tag count and updated date as shown on the Ollama library page. Vendor, family and task are inferred from the model name; weights license is not published on the listing."
  },
  "tags": [
    "ollama",
    "local",
    "vision"
  ],
  "lifecycle": "stable"
}
