{
  "schema": "https://ai-atoms.com/schemas/model-v1.json",
  "type": "model",
  "id": "model/medllama2",
  "version": "1.0.0",
  "name": "medllama2",
  "description": "Fine-tuned Llama 2 model to answer medical questions based on an open source medical dataset.",
  "vendor": "Siraj Raval",
  "family": "MedLlama",
  "task": "text-generation",
  "capabilities": [],
  "parameter_sizes": [
    "7b"
  ],
  "providers": [
    {
      "name": "Ollama",
      "model_id": "medllama2",
      "url": "https://ollama.com/library/medllama2",
      "pull_command": "ollama pull medllama2",
      "run_command": "ollama run medllama2",
      "tag_count": 17,
      "pulls": "689.4K",
      "updated_at": "2023-10-29"
    }
  ],
  "links": {
    "model_card": "https://ollama.com/library/medllama2"
  },
  "authored_by": "Siraj Raval",
  "source_url": "https://ollama.com/library/medllama2",
  "category": "ai",
  "provenance": {
    "source": "ollama.com/library",
    "source_url": "https://ollama.com/library/medllama2",
    "license": "unknown",
    "imported_at": "2026-09-03",
    "notes": "Description, capabilities, sizes, pulls, tag count and updated date as shown on the Ollama library page. Vendor, family and task are inferred from the model name; weights license is not published on the listing."
  },
  "tags": [
    "ollama",
    "local"
  ],
  "lifecycle": "stable"
}
