{
  "schema": "https://ai-atoms.com/schemas/model-v1.json",
  "type": "model",
  "id": "model/qwen3.8-flash-next",
  "version": "1.0.0",
  "name": "qwen3.8-flash-next",
  "description": "This experimental preview of the architecture that will underpin Qwen4.",
  "vendor": "Alibaba",
  "family": "Qwen3",
  "task": "reasoning",
  "capabilities": [
    "vision",
    "tools",
    "thinking"
  ],
  "providers": [
    {
      "name": "Ollama",
      "model_id": "qwen3.8-flash-next",
      "url": "https://ollama.com/library/qwen3.8-flash-next",
      "pull_command": "ollama pull qwen3.8-flash-next",
      "run_command": "ollama run qwen3.8-flash-next",
      "tag_count": 3,
      "pulls": "63.6K",
      "updated_at": "2026-08-27"
    }
  ],
  "links": {
    "model_card": "https://ollama.com/library/qwen3.8-flash-next"
  },
  "authored_by": "Alibaba",
  "source_url": "https://ollama.com/library/qwen3.8-flash-next",
  "category": "ai",
  "provenance": {
    "source": "ollama.com/library",
    "source_url": "https://ollama.com/library/qwen3.8-flash-next",
    "license": "unknown",
    "imported_at": "2026-09-03",
    "notes": "Description, capabilities, sizes, pulls, tag count and updated date as shown on the Ollama library page. Vendor, family and task are inferred from the model name; weights license is not published on the listing."
  },
  "tags": [
    "ollama",
    "local",
    "vision",
    "tools",
    "thinking"
  ],
  "lifecycle": "stable"
}
