{
  "schema": "https://ai-atoms.com/schemas/model-v1.json",
  "type": "model",
  "id": "model/llama4",
  "version": "1.0.0",
  "name": "llama4",
  "description": "Meta's latest collection of multimodal models.",
  "vendor": "Meta",
  "family": "Llama 4",
  "task": "multimodal",
  "capabilities": [
    "vision",
    "tools"
  ],
  "parameter_sizes": [
    "16x17b",
    "128x17b"
  ],
  "providers": [
    {
      "name": "Ollama",
      "model_id": "llama4",
      "url": "https://ollama.com/library/llama4",
      "pull_command": "ollama pull llama4",
      "run_command": "ollama run llama4",
      "tag_count": 11,
      "pulls": "1.8M",
      "updated_at": "2025-06-16"
    }
  ],
  "links": {
    "model_card": "https://ollama.com/library/llama4"
  },
  "authored_by": "Meta",
  "source_url": "https://ollama.com/library/llama4",
  "category": "ai",
  "provenance": {
    "source": "ollama.com/library",
    "source_url": "https://ollama.com/library/llama4",
    "license": "unknown",
    "imported_at": "2026-09-03",
    "notes": "Description, capabilities, sizes, pulls, tag count and updated date as shown on the Ollama library page. Vendor, family and task are inferred from the model name; weights license is not published on the listing."
  },
  "tags": [
    "ollama",
    "local",
    "vision",
    "tools"
  ],
  "lifecycle": "stable"
}
