{
  "schema": "https://ai-atoms.com/schemas/model-v1.json",
  "type": "model",
  "id": "model/nemotron",
  "version": "1.0.0",
  "name": "nemotron",
  "description": "Llama-3.1-Nemotron-70B-Instruct is a large language model customized by NVIDIA to improve the helpfulness of LLM generated responses to user queries.",
  "vendor": "NVIDIA",
  "family": "Nemotron",
  "task": "text-generation",
  "capabilities": [
    "tools"
  ],
  "parameter_sizes": [
    "70b"
  ],
  "providers": [
    {
      "name": "Ollama",
      "model_id": "nemotron",
      "url": "https://ollama.com/library/nemotron",
      "pull_command": "ollama pull nemotron",
      "run_command": "ollama run nemotron",
      "tag_count": 17,
      "pulls": "616K",
      "updated_at": "2024-10-16"
    }
  ],
  "links": {
    "model_card": "https://ollama.com/library/nemotron"
  },
  "authored_by": "NVIDIA",
  "source_url": "https://ollama.com/library/nemotron",
  "category": "ai",
  "provenance": {
    "source": "ollama.com/library",
    "source_url": "https://ollama.com/library/nemotron",
    "license": "unknown",
    "imported_at": "2026-09-03",
    "notes": "Description, capabilities, sizes, pulls, tag count and updated date as shown on the Ollama library page. Vendor, family and task are inferred from the model name; weights license is not published on the listing."
  },
  "tags": [
    "ollama",
    "local",
    "tools"
  ],
  "lifecycle": "stable"
}
