{
  "schema": "https://ai-atoms.com/schemas/model-v1.json",
  "type": "model",
  "id": "model/flux-2-klein-9b",
  "version": "1.0.0",
  "name": "FLUX 2 Klein 9B",
  "description": "Ultra-fast distilled image model with enhanced quality; unifies image generation and editing in a single model.",
  "vendor": "Black Forest Labs",
  "family": "FLUX 2",
  "task": "other",
  "capabilities": [],
  "providers": [
    {
      "name": "Cloudflare Workers AI",
      "model_id": "@cf/black-forest-labs/flux-2-klein-9b",
      "url": "https://developers.cloudflare.com/workers-ai/models/flux-2-klein-9b/"
    }
  ],
  "links": {
    "model_card": "https://developers.cloudflare.com/workers-ai/models/flux-2-klein-9b/"
  },
  "authored_by": "Black Forest Labs",
  "source_url": "https://model-atoms.com/atoms/model-card/cf-black-forest-labs-flux-2-klein-9b/",
  "category": "ai",
  "provenance": {
    "source": "model-atoms.com",
    "source_url": "https://model-atoms.com/atoms/model-card/cf-black-forest-labs-flux-2-klein-9b/",
    "license": "unknown",
    "imported_at": "2026-09-03",
    "notes": "Card as published by model-atoms.com from the Cloudflare Workers AI model list; weights license not recorded there."
  },
  "tags": [
    "cloudflare",
    "workers-ai"
  ],
  "lifecycle": "stable"
}
