{
  "schema": "https://ai-atoms.com/schemas/model-v1.json",
  "type": "model",
  "id": "model/megadolphin",
  "version": "1.0.0",
  "name": "megadolphin",
  "description": "MegaDolphin-2.2-120b is a transformation of Dolphin-2.2-70b created by interleaving the model with itself.",
  "vendor": "Cognitive Computations",
  "family": "Dolphin",
  "task": "text-generation",
  "capabilities": [],
  "parameter_sizes": [
    "120b"
  ],
  "providers": [
    {
      "name": "Ollama",
      "model_id": "megadolphin",
      "url": "https://ollama.com/library/megadolphin",
      "pull_command": "ollama pull megadolphin",
      "run_command": "ollama run megadolphin",
      "tag_count": 19,
      "pulls": "567.2K",
      "updated_at": "2024-01-11"
    }
  ],
  "links": {
    "model_card": "https://ollama.com/library/megadolphin"
  },
  "authored_by": "Cognitive Computations",
  "source_url": "https://ollama.com/library/megadolphin",
  "category": "ai",
  "provenance": {
    "source": "ollama.com/library",
    "source_url": "https://ollama.com/library/megadolphin",
    "license": "unknown",
    "imported_at": "2026-09-03",
    "notes": "Description, capabilities, sizes, pulls, tag count and updated date as shown on the Ollama library page. Vendor, family and task are inferred from the model name; weights license is not published on the listing."
  },
  "tags": [
    "ollama",
    "local"
  ],
  "lifecycle": "stable"
}
