{
  "schema": "https://ai-atoms.com/schemas/model-v1.json",
  "type": "model",
  "id": "model/granite3-guardian",
  "version": "1.0.0",
  "name": "granite3-guardian",
  "description": "The IBM Granite Guardian 3.0 2B and 8B models are designed to detect risks in prompts and/or responses.",
  "vendor": "IBM",
  "family": "Granite",
  "task": "text-generation",
  "capabilities": [],
  "parameter_sizes": [
    "2b",
    "8b"
  ],
  "providers": [
    {
      "name": "Ollama",
      "model_id": "granite3-guardian",
      "url": "https://ollama.com/library/granite3-guardian",
      "pull_command": "ollama pull granite3-guardian",
      "run_command": "ollama run granite3-guardian",
      "tag_count": 10,
      "pulls": "335K",
      "updated_at": "2024-11-19"
    }
  ],
  "links": {
    "model_card": "https://ollama.com/library/granite3-guardian"
  },
  "authored_by": "IBM",
  "source_url": "https://ollama.com/library/granite3-guardian",
  "category": "ai",
  "provenance": {
    "source": "ollama.com/library",
    "source_url": "https://ollama.com/library/granite3-guardian",
    "license": "unknown",
    "imported_at": "2026-09-03",
    "notes": "Description, capabilities, sizes, pulls, tag count and updated date as shown on the Ollama library page. Vendor, family and task are inferred from the model name; weights license is not published on the listing."
  },
  "tags": [
    "ollama",
    "local"
  ],
  "lifecycle": "stable"
}
